{
  "schema_version": "hdp.cms-pos-producer.v1",
  "record_type": "cms_pos_source_result",
  "fixture_id": "fixture:cms:pos:official-release-changed",
  "source_id": "source:cms:pos",
  "release": {
    "source_id": "source:cms:pos",
    "release_id": "release:cms:pos:2026-q1",
    "release_label": "CMS Provider of Services synthetic Q1 2026",
    "source_period": "2026-Q1",
    "source_url": "https://data.cms.gov/provider-data/dataset/cms-pos",
    "release_locator": "https://data.cms.gov/provider-data/dataset/cms-pos/releases",
    "landing_page": "https://data.cms.gov/provider-data/dataset/cms-pos",
    "published_at": "2026-01-15T00:00:00Z",
    "release_fingerprint": "sha256:aaaaaaaaaaaaaaaaaaaaaaaaaaaaaaaaaaaaaaaaaaaaaaaaaaaaaaaaaaaaaaaa"
  },
  "distribution": {
    "distribution_id": "distribution:cms:pos:2026-q1-csv",
    "url": "https://data.cms.gov/provider-data/dataset/cms-pos/files/2026-q1.csv",
    "media_type": "text/csv",
    "etag": "\"cms-pos-q1\"",
    "last_modified": null,
    "distribution_fingerprint": "sha256:bbbbbbbbbbbbbbbbbbbbbbbbbbbbbbbbbbbbbbbbbbbbbbbbbbbbbbbbbbbbbbbb",
    "content_sha256": "sha256:cccccccccccccccccccccccccccccccccccccccccccccccccccccccccccccccc",
    "byte_length": 91
  },
  "receipt": {
    "receipt_id": "receipt:cms:pos:eeeeeeeeeeeeeeeeeeeeeeee",
    "probe_state": "changed",
    "state": "changed",
    "source_id": "source:cms:pos",
    "release_id": "release:cms:pos:2026-q1",
    "release_fingerprint": "sha256:aaaaaaaaaaaaaaaaaaaaaaaaaaaaaaaaaaaaaaaaaaaaaaaaaaaaaaaaaaaaaaaa",
    "distribution_id": "distribution:cms:pos:2026-q1-csv",
    "distribution_fingerprint": "sha256:bbbbbbbbbbbbbbbbbbbbbbbbbbbbbbbbbbbbbbbbbbbbbbbbbbbbbbbbbbbbbbbb",
    "content_sha256": "sha256:cccccccccccccccccccccccccccccccccccccccccccccccccccccccccccccccc",
    "artifact_id": "artifact:cms:pos:cccccccccccccccccccccccccccccccc",
    "idempotency_key": "idempotency:cms:pos:dddddddddddddddddddddddddddddddd",
    "acknowledged": true,
    "stream_state": "completed",
    "received_bytes": 91,
    "chunk_count": 1,
    "row_count": 2,
    "failure_reason": null
  },
  "rows": [
    {
      "source_record_id": "record:cms:pos:11111111111111111111111111111111",
      "source_identifier_column": "PRVDR_NUM",
      "source_identifier": "100001",
      "row_number": 2,
      "row_sha256": "sha256:ffffffffffffffffffffffffffffffffffffffffffffffffffffffffffffffff",
      "source_selector": "csv:PRVDR_NUM=100001",
      "fields": {
        "PRVDR_NUM": "100001",
        "FAC_NAME": "Example North Hospital",
        "STATE": "PA"
      }
    },
    {
      "source_record_id": "record:cms:pos:22222222222222222222222222222222",
      "source_identifier_column": "PRVDR_NUM",
      "source_identifier": "100002",
      "row_number": 3,
      "row_sha256": "sha256:9999999999999999999999999999999999999999999999999999999999999999",
      "source_selector": "csv:PRVDR_NUM=100002",
      "fields": {
        "PRVDR_NUM": "100002",
        "FAC_NAME": "Example South Hospital",
        "STATE": "OH"
      }
    }
  ],
  "budget": {
    "max_bytes": 131072,
    "max_chunks": 128,
    "max_seconds": 60.0,
    "max_chunk_bytes": null
  },
  "authority_limits": {
    "source_scoped": true,
    "acquisition_allowed": false,
    "mutation_allowed": false,
    "canonical_identity_admission_allowed": false,
    "fact_admission_allowed": false,
    "publication_allowed": false,
    "production_allowed": false
  },
  "preview": {
    "authorized": true,
    "max_rows": 100
  }
}
